{
  "schema_version": "1.0.0",
  "payload_type": "discover_insights",
  "vertical": "real_estate",
  "insights": [
    {
      "insight_id": "real_estate_INS_001",
      "question_text": "Is our reported collection rate actually 95% or is the data inflating it?",
      "dashboard_link": "https://demo.bayesiq.com/dashboards/real_estate/overview",
      "finding_ids": [
        "metric_mismatch"
      ]
    }
  ]
}
